{
    "title": "Intro to QAOA",
    "authors": [
        {
            "id": "jack_ceroni"
        }
    ],
    "dateOfPublication": "2020-11-18T00:00:00",
    "dateOfLastModification": "2021-01-11T00:00:00",
    "categories": [
        "Optimization"
    ],
    "tags": [],
    "previewImages": [
        {
            "type": "thumbnail",
            "uri": "qaoa_layer.png"
        }
    ],
    "seoDescription": "",
    "doi": "",
    "canonicalURL": "https://pennylane.ai/qml/demos/tutorial_qaoa_intro.html",
    "references": [
        {
            "id": "",
            "title": "",
            "authors": "",
            "year": "",
            "journal": "",
            "doi": "",
            "url": ""
        }
    ],
    "basedOnPapers": [],
    "referencedByPapers": [],
    "relatedContent": [
        {
            "type": "demonstration",
            "id": "",
            "weight": 1.0
        },
        {
            "type": "demonstration",
            "id": "",
            "weight": 1.0
        },
        {
            "type": "demonstration",
            "id": "",
            "weight": 1.0
        }
    ]
}