{
    "title": "Quantum Teleportation",
    "authors": [
        {
            "id": "matthew_silverman"
        }
    ],
    "dateOfPublication": "2023-10-20T00:00:00+00:00",
    "dateOfLastModification": "2024-01-01T00:00:00+00:00",
    "categories": [
        "Getting Started",
        "Quantum Computing"
    ],
    "tags": [],
    "previewImages": [
        {
            "type": "thumbnail",
            "uri": "/_static/demonstration_assets/teleportation/thumbnail_teleportation.png"
        },
        {
            "type": "large_thumbnail",
            "uri": "/_static/large_demo_thumbnails/thumbnail_large_teleportation.png"
        }
    ],
    "seoDescription": "Transmit arbitrary quantum states using quantum teleportation",
    "doi": "",
    "canonicalURL": "/qml/demos/tutorial_teleportation",
    "references": [
        {
            "id": "Teleportation1993",
            "type": "article",
            "title": "Teleporting an unknown quantum state via dual classical and Einstein-Podolsky-Rosen channels",
            "authors": "C. H. Bennett, G. Brassard, C. Cr√©peau, R. Jozsa, A. Peres, W. K. Wootters",
            "year": "1993",
            "publisher": "",
            "journal": "Phys. Rev. Lett.",
            "doi": "10.1103/PhysRevLett.70.1895",
            "url": "https://journals.aps.org/prl/abstract/10.1103/PhysRevLett.70.1895"
        },
        {
            "id": "NandC2000",
            "type": "book",
            "title": "Quantum Computation and Quantum Information",
            "authors": "M. A. Nielsen, and I. L. Chuang",
            "year": "2000",
            "publisher": "Cambridge University Press",
            "journal": "",
            "url": ""
        },
        {
            "id": "Codebook",
            "type": "webpage",
            "title": "Xanadu Quantum Codebook",
            "authors": "C. Albornoz, G. Alonso, M. Andrenkov, P. Angara, A. Asadi, A. Ballon, S. Bapat, I. De Vlugt, O. Di Matteo, P. Finlay, A. Fumagalli, A. Gardhouse, N. Girard, A. Hayes, J. Izaac, R. Janik, T. Kalajdzievski, N. Killoran, J. Soni, D. Wakeham",
            "year": "2021",
            "publisher": "",
            "journal": "",
            "url": "https://codebook.xanadu.ai/I.15"
        }
    ],
    "basedOnPapers": [],
    "referencedByPapers": [],
    "relatedContent": [
        {
            "type": "demonstration",
            "id": "tutorial_zx_calculus",
            "weight": 1.0
        },
        {
            "type": "demonstration",
            "id": "tutorial_mbqc",
            "weight": 1.0
        }
    ]
}
