{
    "title": "How to create dynamic circuits with mid-circuit measurements",
    "authors": [
        {
            "id": "david_wierichs"
        }
    ],
    "dateOfPublication": "2024-05-03T00:00:00+00:00",
    "dateOfLastModification": "2024-05-03T00:00:00+00:00",
    "categories": [
        "Getting Started",
        "Quantum Computing"
    ],
    "tags": ["how to"],
    "previewImages": [
        {
            "type": "thumbnail",
            "uri": "/_static/demonstration_assets/regular_demo_thumbnails/thumbnail_how_to_create_dynamic_mcm_circuits.png"
        },
        {
            "type": "large_thumbnail",
            "uri": "/_static/large_demo_thumbnails/thumbnail_large_how_to_create_dynamic_mcm_circuits.png"
        }
    ],
    "seoDescription": "Learn how to create dynamic circuits with control flow based on mid-circuit measurements.",
    "doi": "",
    "canonicalURL": "/qml/demos/tutorial_how_to_create_dynamic_mcm_circuits",
    "references": [],
    "basedOnPapers": [],
    "referencedByPapers": [],
    "relatedContent": [
        {
            "type": "demonstration",
            "id": "tutorial_teleportation",
            "weight": 1.0
        },
        {
            "type": "demonstration",
            "id": "tutorial_mbqc",
            "weight": 1.0
        },
        {
            "type": "demonstration",
            "id": "tutorial_how_to_collect_mcm_stats",
            "weight": 1.0
        }
    ]
}
