{
    "title": "Quantum gradients with backpropagation",
    "authors": [
        {
            "id": "josh_izaac"
        }
    ],
    "dateOfPublication": "2020-08-11T00:00:00+00:00",
    "dateOfLastModification": "2024-01-01T00:00:00+00:00",
    "categories": [
        "Getting Started"
    ],
    "tags": [],
    "previewImages": [
        {
            "type": "thumbnail",
            "uri": "/_static/demonstration_assets/regular_demo_thumbnails/thumbnail_quantum_gradients_backpropagation.png"
        }
    ],
    "seoDescription": "Using backpropagation can speed up training of quantum circuits compared to the parameter-shift ruleâ€”if you are using a simulator.",
    "doi": "",
    "canonicalURL": "/qml/demos/tutorial_backprop",
    "references": [],
    "basedOnPapers": [],
    "referencedByPapers": [],
    "relatedContent": [
        {
            "type": "demonstration",
            "id": "tutorial_quantum_natural_gradient",
            "weight": 1.0
        }
    ]
}
