{
    "title": "Differentiable pulse programming with qubits in PennyLane",
    "authors": [
        {
            "id": "korbinian_kottmann"
        }
    ],
    "dateOfPublication": "2023-03-08T00:00:00",
    "dateOfLastModification": "2023-03-08T00:00:00",
    "categories": [],
    "tags": [],
    "previewImages": [
        {
            "type": "thumbnail",
            "uri": "/_images/thumbnail_tutorial_pulse_programming.png"
        },
        {
            "type": "hero_image",
            "uri": "/_static/hero_illustrations/thumbnail_large_pulse_programming.png"
        }
    ],
    "seoDescription": "Simulating differentialble pulse programs in PennyLane with qubits",
    "doi": "",
    "canonicalURL": "/qml/demos/tutorial_pulse_programming101",
    "references": [
        {
            "id": "Mitei",
            "title": "Gate-free state preparation for fast variational quantum eigensolver simulations: ctrl-VQE",
            "authors": "Oinam Romesh Meitei, Bryan T. Gard, George S. Barron, David P. Pappas, Sophia E. Economou, Edwin Barnes, Nicholas J. Mayhall",
            "year": "2020",
            "publisher": "",
            "doi": "",
            "url": "https://arxiv.org/abs/2008.04302"
        },
        {
            "id": "Sheldon2016",
            "title": "Procedure for systematically tuning up crosstalk in the cross resonance gate",
            "authors": "Sarah Sheldon, Easwar Magesan, Jerry M. Chow, Jay M. Gambetta",
            "year": "2016",
            "publisher": "",
            "doi": "",
            "url": "https://arxiv.org/abs/1603.04821"
        },
        {
            "id": "Leng2022",
            "title": "Differentiable Analog Quantum Computing for Optimization and Control",
            "authors": "Jiaqi Leng, Yuxiang Peng, Yi-Ling Qiao, Ming Lin, Xiaodi Wu",
            "year": "2022",
            "publisher": "",
            "doi": "",
            "url": "https://arxiv.org/abs/2210.15812"
        },
        {
            "id": "Asthana2022",
            "title": "Minimizing state preparation times in pulse-level variational molecular simulations",
            "authors": "Ayush Asthana, Chenxu Liu, Oinam Romesh Meitei, Sophia E. Economou, Edwin Barnes, Nicholas J. Mayhall",
            "year": "2022",
            "publisher": "",
            "doi": "",
            "url": "https://arxiv.org/abs/2203.06818"
        },
        {
            "id": "Russell2016",
            "title": "Quantum Control Landscapes Are Almost Always Trap Free",
            "authors": "Benjamin Russell, Herschel Rabitz, Rebing Wu",
            "year": "2016",
            "publisher": "",
            "doi": "",
            "url": "https://arxiv.org/abs/1608.06198"
        }
    ],
    "basedOnPapers": [],
    "referencedByPapers": [],
    "relatedContent": []
}