{
    "title": "Optimization using SPSA",
    "authors": [
        {
            "id": "antal_szava"
        }
    ],
    "dateOfPublication": "2021-03-19T00:00:00",
    "dateOfLastModification": "2022-09-13T00:00:00",
    "categories": [
        "Optimization"
    ],
    "tags": [],
    "previewImages": [
        {
            "type": "thumbnail",
            "uri": "spsa_mntn.png"
        }
    ],
    "seoDescription": "",
    "doi": "",
    "canonicalURL": "https://pennylane.ai/qml/demos/spsa.html",
    "references": [],
    "basedOnPapers": [],
    "referencedByPapers": [],
    "relatedContent": []
}