{
    "title": "Quantum circuit structure learning",
    "authors": [
        {
            "id": "angus_lowe"
        }
    ],
    "dateOfPublication": "2019-10-16T00:00:00",
    "dateOfLastModification": "2021-01-20T00:00:00",
    "categories": [
        "Optimization"
    ],
    "tags": [],
    "previewImages": [
        {
            "type": "thumbnail",
            "uri": "rotoselect_structure.png"
        }
    ],
    "seoDescription": "",
    "doi": "",
    "canonicalURL": "https://pennylane.ai/qml/demos/tutorial_rotoselect.html",
    "references": [
        {
            "id": "",
            "title": "",
            "authors": "",
            "year": "",
            "journal": "",
            "doi": "",
            "url": ""
        }
    ],
    "basedOnPapers": [],
    "referencedByPapers": [],
    "relatedContent": [
        {
            "type": "demonstration",
            "id": "",
            "weight": 1.0
        },
        {
            "type": "demonstration",
            "id": "",
            "weight": 1.0
        },
        {
            "type": "demonstration",
            "id": "",
            "weight": 1.0
        }
    ]
}