{
    "title": "Introducing tensor networks for quantum practicioners",
    "authors": [
        {
            "username": "emiliano"
        },
        {
            "username": "ShiroRaven"
        }
    ],
    "dateOfPublication": "2024-08-06T00:00:00+00:00",
    "dateOfLastModification": "2024-08-06T00:00:00+00:00",
    "categories": [
        "Getting Started"
    ],
    "tags": [],
    "previewImages": [
        {
            "type": "thumbnail",
            "uri": "/_static/demo_thumbnails/regular_demo_thumbnails/thumbnail_tensor_network_basics.png"
        },
        {
            "type": "large_thumbnail",
            "uri": "/_static/demo_thumbnails/large_demo_thumbnails/thumbnail_large_tensor_network_basics.png"
        }
    ],
    "seoDescription": "An introductory tutorial to tensor networks.",
    "doi": "",
    "canonicalURL": "/qml/demos/tutorial_tn_basics",
    "references": [
        {
            "id": "huggins",
            "type": "article",
            "title": "Towards quantum machine learning with tensor networks",
            "authors": "W. Huggins, P. Patil, B. Mitchell, K. B. Whaley, and E. M. Stoudenmire",
            "year": "2019",
            "journal": "Quantum Science and Technology",
            "url": "http://dx.doi.org/10.1088/2058-9565/aaea94"
        },
        {
            "id": "orus",
            "type": "article",
            "title": "A practical introduction to tensor networks: Matrix product states and projected entangled pair states",
            "authors": "R. Or√∫s",
            "year": "2014",
            "journal": "Annals of Physics",
            "url": "https://www.sciencedirect.com/science/article/pii/S0003491614001596"
        }
    ],
    "basedOnPapers": [],
    "referencedByPapers": [],
    "relatedContent": []
}