{
    "title": "Your Guide to PennyLane if You Know Qiskit",
    "authors": [
        {
            "id": "isaac_de_vlugt"
        }
    ],
    "dateOfPublication": "2024-07-01T00:00:00+00:00",
    "dateOfLastModification": "2024-07-01T00:00:00+00:00",
    "categories": [
        "Quantum Computing"
    ],
    "tags": [],
    "previewImages": [
        {
            "type": "thumbnail",
            "uri": "/_static/demonstration_assets/zx_calculus/thumbnail_tutorial_zx_calculus.png"
        }
    ],
    "seoDescription": "This is your ultimate guide to PennyLane if you already know Qiskit.",
    "doi": "",
    "canonicalURL": "/qml/demos/ultimate_guide_to_pennylane_knowing_qiskit",
    "references": [],
    "basedOnPapers": [],
    "referencedByPapers": [],
    "relatedContent": [
        {
            "type": "demonstration",
            "id": "tutorial_qubit_rotation",
            "weight": 1.0
        }
    ]
}
