{
    "title": "Alleviating barren plateaus with local cost functions",
    "authors": [
        {
            "id": "thomas_storwick"
        }
    ],
    "dateOfPublication": "2020-09-09T00:00:00",
    "dateOfLastModification": "2021-01-28T00:00:00",
    "categories": [
        "Optimization"
    ],
    "tags": [],
    "previewImages": [
        {
            "type": "thumbnail",
            "uri": "tions/Cerezo_et_al_local_cost_functions.png"
        }
    ],
    "seoDescription": "",
    "doi": "",
    "canonicalURL": "https://pennylane.ai/qml/demos/tutorial_local_cost_functions.html",
    "references": [
        {
            "id": "",
            "title": "",
            "authors": "",
            "year": "",
            "journal": "",
            "doi": "",
            "url": ""
        }
    ],
    "basedOnPapers": [],
    "referencedByPapers": [],
    "relatedContent": [
        {
            "type": "demonstration",
            "id": "",
            "weight": 1.0
        },
        {
            "type": "demonstration",
            "id": "",
            "weight": 1.0
        },
        {
            "type": "demonstration",
            "id": "",
            "weight": 1.0
        }
    ]
}