{
    "title": "Optimizing a quantum optical neural network",
    "authors": [
        {
            "id": "theodor_isacsson"
        }
    ],
    "dateOfPublication": "2020-08-05T00:00:00",
    "dateOfLastModification": "2022-03-08T00:00:00",
    "categories": [
        "Optimization"
    ],
    "tags": [],
    "previewImages": [
        {
            "type": "thumbnail",
            "uri": "qonn_thumbnail.png"
        }
    ],
    "seoDescription": "",
    "doi": "",
    "canonicalURL": "https://pennylane.ai/qml/demos/qonn.html",
    "references": [],
    "basedOnPapers": [],
    "referencedByPapers": [],
    "relatedContent": []
}